MCP Server Name,GitHub Repo URL,Description,Category
Continue,https://github.com/continuedev/continue,vscode auto complete and chat tool (full feature support),Code Editor & Development
gpt-computer-assistant,https://github.com/Upsonic/gpt-computer-assistant,"dockerized mcp client with Anthropic, OpenAI and Langchain.",AI Assistant & Integration
MCP-Connect,https://github.com/EvalsOne/mcp-connect,A client that enables cloud-based AI services to access local Stdio based MCP servers by HTTP/HTTPS requests.,MCP Integration
codemirror-mcp,https://github.com/marimo-team/codemirror-mcp,CodeMirror extension that implements the Model Context Protocol (MCP) for resource mentions and prompt commands.,Code Editor & Development
LibreChat,https://www.librechat.ai/,"Open-source AI Web UI, supporting multiple providers including OpenAI, Anthropic, Google, Ollama, and local models. Includes MCP support for Agents.",AI Chat Interface
mcphub.nvim,https://github.com/ravitemer/mcphub.nvim,A Neovim plugin that provides a UI and api to interact with MCP servers.,IDE Integration
Nerve,https://github.com/evilsocket/nerve,is an open source command line tool designed to be a simple yet powerful platform for creating and executing MCP integrated LLM-based agents.,AI Agent Platform
create-mcp-ts,https://github.com/stephencme/create-mcp-ts,"Create a new MCP server in TypeScript, batteries included - supports user-defined templates!",MCP Development
LiteMCP,https://github.com/wong2/litemcp,A TypeScript framework for building MCP servers elegantly,MCP Development Framework
mcp-framework,https://github.com/QuantGeekDev/mcp-framework,Fast and elegant Typescript framework for building MCP servers,MCP Development Framework
oatpp-mcp,https://github.com/oatpp/oatpp-mcp,Anthropic's Model Context Protocol implementation for Oat++,MCP Development Framework
centralmind/gateway,https://github.com/centralmind/gateway,"CLI that generates MCP tools based on your Database schema and data using AI and host as REST, MCP or MCP-SSE server",MCP & Database Integration
ToolHive,https://github.com/StacklokLabs/toolhive,"A lightweight utility designed to simplify the deployment and management of MCP servers, ensuring ease of use, consistency, and security through containerization",MCP Server Management
Salesforce MCP Server,https://github.com/kablewy/salesforce-mcp-server,A Model Context Protocol server implementation for interacting with Salesforce through its REST API using jsforce,CRM
Salesforce MCP Server,https://github.com/kablewy/salesforce-mcp-server,A Model Context Protocol server implementation for interacting with Salesforce through its REST API using jsforce,CRM
HubSpot MCP Server,https://www.npmjs.com/package/@hubspot/mcp-server,Official HubSpot MCP server enabling AI clients to interact with HubSpot data and perform CRM operations through a standardized interface,CRM
Microsoft 365 MCP Server,https://github.com/softeria/ms-365-mcp-server,A Model Context Protocol server for interacting with Microsoft 365 services through the Graph API,Office Suite
Monday.com MCP Server,https://github.com/sakce/mcp-server-monday,"MCP Server for monday.com , enabling MCP clients to interact with Monday.com boards, items, updates, and documents",Project Management
Asana MCP Server,https://github.com/roychri/mcp-server-asana,"MCP server implementation for Asana that allows interaction with Asana API from MCP clients to manage tasks, projects, and workspaces",Project Management
Zendesk MCP Server,https://github.com/reminia/zendesk-mcp-server,"A Model Context Protocol server for Zendesk providing tools for retrieving and managing tickets, users, and other Zendesk resources",Customer Support
Pipedrive MCP Server,https://github.com/WillDent/pipedrive-mcp-server,"A Model Context Protocol server that connects to the Pipedrive API v2 , allowing you to expose Pipedrive CRM data and functionality to LLM applications",CRM